{
  "schema_version": "1.0.0",
  "record_type": "source",
  "id": "source-otb-units-public",
  "name": "Public tenancy fields (from Tier-1 rent roll)",
  "location": {
    "repository_path": "src/data/units.public.json"
  },
  "revision": "git-blob:10fd8643ed15c5bd1fc7d5618ea4d104401ca74b",
  "sha256": "e5ec19724591fe9e7ad78d6b080692e207bc0e2344f558f21facd6be51ebbb86",
  "kind": "operational-record",
  "authority_domains": [
    "operations"
  ],
  "verification": {
    "state": "unverified",
    "notes": "Public-safe tenancy fields derived from the Tier-1 rent roll (units.json). Lease SF is a lease definition, not a measured footprint."
  }
}
