{
  "schema_version": "1.0.0",
  "record_type": "source",
  "id": "source-otb-cad-boulev-clean",
  "name": "Architect CAD — Boulev_CLEAN.dxf",
  "location": {
    "repository_path": "cad/Boulev_CLEAN.dxf"
  },
  "revision": "worktree-sha256:6c31f953ee5328ce",
  "sha256": "6c31f953ee5328ce15e0fd9e7bf1bdf6264b18f15ff7ceaef141b66d5ab6738f",
  "kind": "cad",
  "authority_domains": [
    "geometry",
    "dimensions"
  ],
  "units": [
    "ft"
  ],
  "verification": {
    "state": "unverified",
    "notes": "Architect CAD (cleaned). Parent of heights.json and the geometry.json access layer; not a direct input to this slice. Drawing date/author/as-built status not recorded in the repo."
  }
}
