{
  "schema_version": "1.0.0",
  "record_type": "source",
  "id": "source-otb-pylon-register",
  "name": "Pylon panel register (operator)",
  "location": {
    "repository_path": "src/data/pylon.json"
  },
  "revision": "worktree-sha256:6c5274d02b5e57cc",
  "sha256": "6c5274d02b5e57ccf53258952c1af79569065c859569dd52b1813ea04dc4759f",
  "kind": "operational-record",
  "authority_domains": [
    "operations"
  ],
  "verification": {
    "state": "unverified",
    "notes": "Operator panel register (D-19b, 2026-09-17): panel order, nominal sizes and panel→unit assignment. Not a measured sign drawing — cabinet, posts, gaps and installed panel dimensions are unmeasured."
  }
}
