{
  "schema_version": "1.0.0",
  "record_type": "source",
  "id": "source-otb-geometry-json",
  "name": "OTB site geometry (plat transcription + CAD access layer)",
  "location": {
    "repository_path": "src/data/geometry.json"
  },
  "revision": "worktree-sha256:f14a63ecf6ced130",
  "sha256": "f14a63ecf6ced130d1cdebf70e54df8afe211d79f280dcbca8231c7c39677226",
  "kind": "verified-property-data",
  "authority_domains": [
    "geometry",
    "dimensions"
  ],
  "units": [
    "ft"
  ],
  "owner": {
    "party": "Belle Realty of Lafayette, LLC (operator: Orange Ocean, LLC)"
  },
  "verification": {
    "state": "unverified",
    "notes": "Repo transcription of the recorded plat (Montagnet & Domingue 2019 ALTA survey + 2020 site plan; natives in reference/plats/) plus architect-CAD access layer. REV 15 (2026-09-30): every frontage is a plat string except the 131/133 split inside the 37.2' block. Foot definition not stated; recorded as ft."
  }
}
